ID,Language_ID,Name,Description,Example_IDs,Source,Schema
constr95,indo1316,Prepositional R construction,"A/S and P are unmarked. R appears as a prepositional object (prepositions kepada ‘to’, untuk ‘for’, etc.). Transitive verbs include the transitive prefix men-.",ex232;ex406,sneddon-1996,A (TRANS-)V T Prep (kepada) R
constr96,indo1316,Applicative secundative construction,Here the verb takes additionally (apart from the transitive prefix) the benefactive applicative suffix -kan or the directional applicative suffix -i.,ex233;ex407,chung-ra-1983,A (TRANS-)V-BEN R T
constr97,indo1316,Basic secundative construction,This construction occurs with a few verbs (with “zero applicative”) only.,ex234,chung-ra-1983,A (TRANS-)V R T
constr98,cham1312,Indirective Prepositional Construction,P/T is unmarked. R is introduced with the preposition para. There is no indexing except for the transitive subject.,ex235,topping-1973;cooreman-1987,(A) subj[A].V T para+R
constr99,cham1312,Secundative Applicative Construction,"Dative shift: The verb is marked by the applicative –I. R is shifted. T is unmarked if indefinite, or demoted to OBL if definite (marked by OBL articles: ni (common) ~ as (proper)). Also GIVE historically includes the applicative marker.",ex236;ex408,cooreman-1987;topping-1973,(A) a-V-APPL T R (OBL) T
constr100,sout2961,Indirective (with T incorporation),"T is (usually) incorporated. R is marked by the enclitic =‘ay. NB: The indirective pattern usually uses T-incorporation, yet unlike secundative pattern, but like the monotransitive pattern, T-incorporation is not obligatory (no examples with T expressed as a free NP are given though).",ex237;ex409,ch001allenfrantz1983,A a+t/p(T+)V R-ay
constr101,sout2961,Secundative with T incorporation,"T is obligatorily incorporated. A, R and T are indexed on the verb. R is unmarked and is the prime object.",ex238;ex410,ch001allenfrantz1983,A a+r+t(T+)V R
constr102,koyr1240,Indirective Prepositional Construction,R is introduced with the dative preposition se when T is more topical (e.g. pronominal) than R.,ex239;ex411,heath-1998,A V T R+se
constr103,koyr1240,Shifted Prepositional Construction,Dative marked R is shifted to the postverbal position when it is more topical (e.g. pronominal) than T.,ex240,heath-1998,A V R+se T
constr104,koyr1240,Double Object Construction,"This construction is possible only for a few canonical ditransitive verbs like noo ’give’ when R is pronominal. R-promotion in a double object construction is obligatory for 1/2 SG pronouns, and preferred if R is (another) pronominal and if T is an NP.",ex241;ex412,heath-1998,A V R T
constr105,malt1254,Indirect object construction,,ex242;ex413,ch01borgcomrie1984,A V.subj[A].(obj[T]).(obj[R]) T lil+R
constr106,nort2722,Dative Construction,"R is marked with the dative/locative postposition =tA. The object agreement (otherwise optional) refers to R. Object agreement preferentially targets topical objects (R, P). R-marking may be optional (see ex. 1813) (only if disambiguated by AGRs?).",ex243;ex414,lapolla-j.-2003,A R-dat T V.obj[R].subj[A]
constr107,nort2722,Genitive Construction,"R/BEN takes genitive case. Yet it is not a possessor, since the order can be changed (unlike in possessive constructions). The same marking occurs in benefactive constructions.",ex244;ex415,lapolla-j.-2003,A R-gen T V.obj[R].subj[A]
constr108,pana1305,Double Object Construction,"Both R and T are marked by the accusative case. There is no agreement on the verb. The word order is variable. If R is postverbal, it is optionally case-marked.",ex245;ex416,dayley-1989,A R-acc T-acc V
constr109,pana1305,Double Object Applicative Construction,"[(A) R.obj T.obj V-APPL] – As in the basic construction, both R and T are marked by the accusative case. The verb takes the applicative suffix. Productive with Beneficiaries: buy-for, kill-for, did-for (p. 117).",ex246,dayley-1989,[(A) R.obj T.obj V-APPL] –
constr110,wapp1239,Dative construction,"The R is marked with dative case, a case that also expresses direction and ‘(talk) to’.",ex247;ex417,thompson-etal-2006[12],[A-nom R-dat T V] –
constr111,jara1245,Ditransitive Construction,check,ex248;ex418,kumar-2006,A-nom R-obl T V
constr112,nucl1347,Double Object construction,,,schwartz-1975;becher-2005,
constr113,yalu1240,Locative Indirective Construction,A and T are unmarked. R is introduced as an oblique with the postposition ma ’at’.,ex249;ex419,ch01luepke2005,A T V R+ma
constr114,yalu1240,Locative secundative construction,"A and R are unmarked. T is introduced as an oblique with the postposition ma ’at’ (which is the same postposition as in the indirective pattern). Apart from R arguments, the Source may also appear in this construction with verbs like ‘steal’ (which also allow for the indirective pattern).",ex250;ex420,ch01luepke2005,A R V T+ma
constr115,yalu1240,Instrumental secundative construction,"Unlike the previous pattern, T is introduced with the instrumental postposition ra.",ex251,ch01luepke2005,A R V T+ra
constr116,yalu1240,Instrumental indirective construction,"With the verb SHOW, R is exceptionally introduced by the instrumental postposition ra.",ex252,ch01luepke2005,A T V R+ra
constr117,yalu1240,Benefactive Indirective Construction,"With verbs of speech, R is marked by the benefactive postposition bE.",ex253,ch01luepke2005,A T V [B ra]
constr118,mani1292,Locative Indirective Construction,A is optinally marked by the agentive/ergative case. T is optionally marked by the patientive/accusative case. R is in the locative/dative case. This is the basic ditransitive pattern noted by both Bhat & Ningomba 1997 and Chelliah 1997.,ex254;ex421,bhat-ningomba-1997;chelliah-1997,A(-erg) R-loc T(-acc) V
constr119,mani1292,Double Object Construction,"Here R (rather than P) is marked by the patientive/accuative case. T is unmarked (apparently always inanimate in this case). NB: This is a peripheral construction, not attested by Chelliah for basic ditransitives (p. 500; FN37), but noted for derived (causative) ditransitives.",ex255,bhat-ningomba-1997;chelliah-1997,A(ag) R.pat T V
constr120,mani1292,Genitive Indirective Construction,"The BEN argument can be marked by genitive case. T is optionally in the patientive/accusative case, as in the basic pattern. It is more often used with the verbal Benefactive (see ‘Applicative’).",ex256,bhat-ningomba-1997,A(ag) R.gen T(pat) V
constr121,tehu1242,Indirective Pattern (with inflecting verbs),"The subject optionally takes the topic-subject marker. The objects are unmarked. A and R may be cross-referenced by proclitics. T, on the other hand, is marked by (3rd person) gender agreement prefixes.",ex257;ex422,fern-garay-na,A+š R T subj[A].obj[R].obj[T].V
constr122,tehu1242,Secundative Pattern (with non-inflecting verbs),"A, R and T arguments are marked with proclitics if pronominal. The R-marker occurs here immediately before the verb stem, as the P-marker of monotransitives (”dative shifting”).",ex258;ex423,,A+š R T subj[A].obj[T].obj[R].V
constr123,teop1238,Basic Secundative Construction,"A is introduced by the direct articles. R and T may be introduced either by direct or oblique (object) forms of articles, depending on person of objects and subject (see flagging). R is encoded similarly to P in terms of word order, case and indexing. Indexing through special object clitics (in some cases through imperfective agreement), usually in agreement with subject (see indexing). Other comment: Inversion effects in ditransitive construction: the form of the secondary O (T), depends on the person of A and R (primary O). (cf. similarly, the form of primary O depends on the person of subject; see monotransitives). Note the inversion effects in a ditransitive construction: if both A and R are SAP pronouns (1,2), then T (the secondary O) remains in the DIR form; otherwise it takes the OBL article: (19) Enaa pasi vaasus avameam a meha taba 1SG will teach OBJ.2PL.IMM DIR.ART other thing ‘I will teach you another thing’ (20) Me paa pasi vaasusu ri (bari) bona meha taba and TAM teach OBJ.3PL (OBJ3SG) OBJ.ART other thing ‘And he taught them another thing’ NB in (19) T is in DIR since A is a SAP pronoun; in (20) T is marked by OBJ article (and optionally introduced by the OBJ form of the 3rd person pronoun; called 4th person pronoun by M).",ex259;ex424,mosel-2010,(art) A [V +r/p] (obl) R (obl) T
constr124,teop1238,Benefactive Indirective Construction,"T/P is a primary object, and BEN is an adjunct introduced by the dative preposition ki (the prepositional object is, as elsewhere, with the oblique article). Note that the latter construction can be transformed into the secundative by preposition incorporation (see applicative construction).",ex260,mosel-2006a,[A [V-t/p] (OBL) T [ki OBL R]]
constr125,nuuu1241,Double Object construction,The R carries the dative (suffix -a) but always precedes the T. The T is not introduced by a linker (Collins 2004 finds this remarkable).,ex261;ex425,ch05collins2004[183-194],[A V R-dat T] –
constr126,kala1399,Secundative Instrumental Construction,"R is in the absolutive case and is cross-referenced by object agreement. T is in the instrumental case and not indexed. This is a basic construction for canonical ditransitives. For the derived indirective construction, see ‘Applicatives’, and ‘Indirective construction’.",ex262,ch001fortescue1984,A-abs R-abs T-ins V.subj[A].obj[R]
constr127,kala1399,Indirective Allative Construction,"T is in the absolutive case and is cross-referenced by object agreement. R is in the allative case and not indexed. This construction is found with less canonical ditransitives with a beneficiary argument, or with applicative (”antibenefactive”) forms of canonical ditransitives (see the ‘secundative construction’).",ex263;ex426,ch001fortescue1984,A-abs T-abs R-all V.subj[A].obj[T]
constr128,kash1277,Dative Construction (Imperfective Series),"In imperfective tenses: A is in the nominative, R in the dative, and T (as P) is either unmarked (nominative) if non-human and/or lower than A on the person hierarchy (1>2>3), or DAT/ACC marked otherwise.",ex264;ex427,wali-koul-1997,A.nom AUX-a/s-(a/s-t/p-r) R.dat T(dat)
constr129,kash1277,Dative Construction (Perfective Series),"In perfective tenses, A carries the ergative case, and T/P is unmarked (nominative). R carries the dative, as in the imperfective series. The verb agrees with the nominative T/P argument, and can take enclitics cross-referencing A, T, and R (in that order).",ex265;ex428,wali-koul-1997,A.erg V-p/s-(a-t/p/s-r) R.dat T.nom
constr130,khan1273,Indirective Construction with VP internal T,A and T/P are unmarked. R is introduced by the postposition e:lti. The verb shows subject agreement (no object agreement). The construction is used when T is non-topical (rhematic/focussed).,ex266,ch001nikolaeva1999,A R+e:lti T V.subj[A]
constr131,khan1273,Indirective Construction with T Fronting,"Here T is topical and dislocated from the verb. A and T remain unflagged. R is still introduced by the postposition e:lti. The verb, in addition to subject agreement, shows number agreement with the topical object. The shifted T here is a (secondary) topic (p. 76).",ex267,ch001nikolaeva1999,A T R+e:lti V.obj[T].subj[A]
constr132,khan1273,Secundative construction,"A and R are unmarked, R being the main object. T takes the locative case -na. The verb shows obligatory object agreement with R, which is the secondary topic in this construction.",ex268;ex2084,ch001nikolaeva1999,A R T-loc V.obj[R].subj[A]
constr133,alam1246,Basic Secundative Construction,"A and R/P are unflagged; the verb cross-references A and R by subject and object enclitics respectively. Apart from canonical ditransitives, also 'rub/smear' verbs can take this pattern.",ex269;ex429,ch001bruce1984,A R T V.subj[A].obj[R]
constr134,alam1246,Locative Indirective Construction,"The verb cross-references A and T by subject and object enclitics respectively. R is introduced by the locative “referent” case enclitic -pnë. Use: With less canonical ditransitives like 'bring', but also with verbs that have a source argument.",ex270;ex430,ch001bruce1984,A R+pnë T V.subj[A].obj[T]
constr135,koas1236,Zero-Flagged Indirective Construction,"A/S is flagged by (overt) nominative case. T/P is flagged by accusative case, R is unflagged (the zero “autonomous” case). A/S is cross-inderxed by subject prefixes or suffixes, T/P by object prefixes, and R by dative prefixes.",ex271;ex431,ch01kimball1991,A-nom T-acc obj[R].obj[T].subj[A].V R
constr136,movi1243,Direct Secundative Construction,"The direct construction is used when A is higher on the animacy hierarchy than R/P. In this construction, A is the first core argument (ARG1), R is a second argument (ARG2), and T is an oblique. A and R are unmarked, T is introduced by an oblique case. A is indexed by a first order clitic (is zero in the 1st person), R/P can be marked a second-order (external) clitic if pronominal.",ex272;ex432,haude-2006,V.DIR-a(--r/p) A R obl.T
constr137,movi1243,Inverse Secundative Construction,"The inverse construction is used when A is lower on the animacy hierarchy than R/P. In this construction, P/R is the first core argument (ARG1), A is a second argument (ARG2), and T is an oblique. As in the direct pattern, both A and R are unmarked and T is introduced by an oblique case. However, here both word order and indexing are reversed: P/R is indexed by a first order clitic, while by a second-order (external) clitic.",ex432;ex272,haude-2006,V.INV-r/p(--a) R A obl.T
constr138,arak1252,Secundative Prepostional Construction,"The usual pattern with ditransitive verbs (unless T is human). A and R are unmarked, and T is introduced by a preposition (most often the oblique preposition (i)ni or locative lo). The verb agrees with R by means of object agreement suffixes.",ex273;ex433,francois-re-2002,A subj[A].V.obj[R] R ni+T
constr139,arak1252,Indirective Prepositional Construction,"The indirect construction can only be used when T is human. In this construction, T is in the object position and indexed on the verbs, while R is introduced by a preposition like (i)sa ‘with; to’.",ex274;ex434,francois-re-2002,A subj[A].V.obj[T] T (i)sa+R
constr140,dyir1250,Dative Indirective Construction,"No indexing on the verb. T is in the absolutive (with nouns), A in the ergative (with nouns), and R is in the dative case. This construction is frequently part of a complex ““implicated NP construction” (see Other Constructions).",ex275,ch001dixon1972,T-abs A-erg V R-dat
constr141,dyir1250,Genitive Indirective Construction,"No indexing on the verb. T is in the absolutive (with nouns), A in the ergative (with nouns), and R stands in simple genitive case, as a possessor in a possessive construction. This is the most common construction with canonical ditransitives.",ex276,ch001dixon1972,T-abs R-gen A-erg V
constr142,dyir1250,Instrumental Secundative Construction,"No indexing on the verb. R is in the absolutive (with nouns), A in the ergative (with nouns), and T is in the instrumental case.",ex277,,R-abs A-erg T-ins V
constr143,tuka1249,Ergative Secundative Construction,"R is the main object: R (like P in the ergative construction) carries nominative case. T is introduced by the CORE preposition te. Indexing is also secundative, insofar as object suffixes index R (prefixal agreement is neutral as it indexes A/S).",ex278;ex435,ch001donohue1999,subj[A].V.obj[R] te+T na+R te+A
constr144,tuka1249,Antipassive Double Oblique Construction,"Flagging is neutral, as A in the “antipassive” construction is introduced by nominative case, both R and T are in CORE case (double object construction). Indexing is neutral, as subject agreement is used for A, and there is no object agreement. Donohue prefers to regard this construction as an “object focus” (pronominal voice) construction rather than antipassive.",ex279,ch001donohue1999,subj[A].V te+T na+A te+R
constr145,tuka1249,Indirective Oblique Construction,"Found with less canonical ditransitives. T is the main object, while R is introduced by the locative/oblique preposition i/di (has general LOC, ALL, ABL functions). A construction with R introduced with ako may also be regarded as a variant of this construction (since the serial verb ako ‘do.for’ has been reanalyzed as benefactive preposition; p. 187). In principle, this construction can also appear in the ergative or antipassive variant.",ex280;ex436,ch001donohue1999,subj[A].V te+T na+A i+R
constr146,arhu1242,Mixed Alignment Construction,"Indexing is secundative, but flagging is indirective. R takes the locative postposition -se’ (also optionally as an ergative marker). This construction can also be used with source arguments ('buy from').",ex281;ex437,frank-1985,[A(-loc) R-loc T subj[A].obj[R].V]
constr147,kore1280,Dative Construction,"The basic construction: A is flagged by the nominative postposition ka/i (or the topic particle nun), T/P by the accusative lul, and R by the dative postpositions (different markers depending on animacy and politeness).",ex282;ex438,sohn-1994;ogrady-1991,A ka R eykey T lul V
constr148,kore1280,Double Object Construction,"Here the dative is replaced by the accusative “for emphatic (i.e. focus) purposes”. Double Object Constructions are not restricted to canonical ditransitives, but also occur with BEN, and other constructions which may be conceived as involving possessor ascension (Sohn, p. 204, ex. 440a). Acceptability of a Double Object Construction varies. O’Grady (p. 53; -> Kang) notes that in some ditransitive constructions (an example with a GIVE verb is given), the double object is preferred to the dative construction. Kozinsky & Polinsky (1993: 189), on the other hand, state that the double object construction is dispreferred by some speakers in general (an example with a SEND verb is given).",ex283;ex439;ex2056,sohn-1994;ogrady-1991,A ka R lul T lul V
constr149,kore1280,Mixed Constructions,"R is marked with what appears to be a combination of dative and accusative case. The latter marker, however, may be analyzed as a (homophonous) pragmatic marker (“focus delimiter”; p. 184) in this construction. R is focused here.",ex284,sohn-1994,A ka R eykey lul T lul V
constr150,kore1280,Indirective Addressee Construction,"With speech act verbs, the addressee is introduced with poko or tele ‘to’. The object may be carry accusative if nominal, but is often a complement (quotative) clause.",ex285,sohn-1994,A ka R tele/poko (T lul) V
constr151,nama1264,Ditransitive Construction,Both R and T are followed by the oblique case suffix -à.,ex286,hagman-1977[76-77],A R-obl T-obl V
constr152,seme1247,Indirective Locative Construction,"R is introduced by the locative preposition ?en (ex. 13a), or by “deictic” locative indicating orientation towards the speaker (ex. 102). T (like P) is optionally introduced by the proclitic hn=, which, however, also appears on pronominal objects of prepositions (p. 264). Indexing is neutral insofar as only A is indexed on the verb. Other comment: hosting a possessive marker p. 252. Only core arguments (or possessors of them), including IO (R; see (30)) can host a possessive enclitic =hn 3POS. (With obliques, 3rd person POS is expressed by the free pronoun kEh. p. 252; (30)",ex287;ex440,kruspe-2004,subj[A].V A-erg ʔen+R (hn+)T
constr153,seme1247,Neutral Benefactive Construction,"Unlike the locative construction, in the benefactive, BEN may be unmarked (alternatively introduced through an “associative” construction (cf. p. 215 (ex. 65); ‘weave my basket/basket for me’)). In imperatives, R is unmarked like a BEN.",ex288;ex441,kruspe-2004,subj[A].V A-erg R (hn+)T
constr154,basq1248,Dative Indirective Construction,"A canonical ditransitive construction which is ergative indirective. A is flagged by the ergative, R by the dative, and T (like P and S) by the absolutive case. T (again, like P and S) is cross-referenced by absolutive prefixes, R by dative suffixes, and A by ergative suffixes.",ex289;ex442,saltarelli-1988;hualde-urbina-2003,A.erg R.dat T.abs t/p/s-V/AUX-d-a
constr155,basq1248,Benefactive Indirective Construction,"Differently from the dative construction, R/BEN is in the “benefactive” case -tzat, affixed to the genitive form of the noun. BEN is not indexed on the verb: The finite verb/auxiliary is monotransitive, not ditransitive.",ex290;ex2049,saltarelli-1988,A.erg R.gen-tzat T.abs t/p/s-V/AUX-a
constr156,garo1247,Dative Construction,"T/P is in the accusative, and R (or BEN or Addressee) is in the dative case. There is no indexing (agreement). It is a a basic ditransitive construction.",ex291;ex443,burling-2004,A(-nom) R-dat T-acc V
constr157,garo1247,Monotransitive (?) Accusative Construction,"With verbs like TELL, TEACH, ORDER, if T is omitted (“not mentioned”), R takes the accusative case.",ex292,burling-2004,A(-nom) R-acc V
constr158,dier1241,Double Object Construction,"Both R and T carry the same case (absolutive or accusative, depending on the type of the nominal). There is no indexing on the verb. This construction is restricted to four verbs.",ex293,,A-erg R-abs T-abs V
constr159,dier1241,Dative Benefactive Construction,"T/P is in absolutive (or accusative, depending on the type of the nominal), and Ben is in the dative case. The verb may optionally take the benefactive marker -yirpa-.",ex294,,A-erg R-dat T-abs V
constr160,djin1251,Dative Construction,"When the arguments are nominal, R is in the dative. T (like P) is in absolutive case. If pronominal, both R and T carry accusative (ex. 446h). (Note that in the same construction, NP is in dative while the coreferential resumptive pronoun is in accusative; see ex. 446b). The verb optionally agrees with R (see ex. 446k).",ex295;ex444,,A.erg V-a/s-(r/p)-(aux) T R.dat
constr161,djin1251,Double Object Construction,"Flagging as in the dative construction, but R is in absolutive case. This construction is restricted to core ditransitives and is not available for Beneficiaries (p. 108). A construction with both objects being pronominal may be also regarded as a double object construction, since both R and T are in accusative. If pronominal, both R and T are in accusative case (ex. 446h).",ex296;ex445,,A.erg V-a/s-r/p-(aux) T R
constr162,djin1251,Allative Construction,"With burdb- ’send’, R carries allative case, and T is unexpectedly in ergative case. SEND is used instead of GIVE if T is 1st/2nd person (see Animacy Effects). Indexing is apparently with T, if pronominal (no forms with pronominal Ts are given though).",ex297,,A.erg V-a/s-(t/p?)-(aux) T R
constr163,itel1242,Dative Ditransitive Construction,"This is an indirective pattern in both cases (T like P unmarked, R in dative). R (rather than T) is indexed, but indexing is not secundative inasmuch as one uses special IO agreement with R.",ex298;ex446,ch001georgvolodin1999,A T subj[A].V.obj[R] R-dat
constr164,itel1242,Dative Monotransitive Construction,"Here also, flagging is indirective (T like P unmarked, R in dative). Indexing is also indirective, as object agreement indexes T.",ex299,ch001georgvolodin1999,A T subj[A].V.obj[T] R-dat
constr165,yuec1235,T-R Double-Object Construction,The T-R order is normal with ‘give’.,ex300;ex447,xu-peyraube-1997[106];matthews-yip-1994[137],A V T R
constr166,yuec1235,R-T Double-Object Construction,"The R-T order is dispreferred with ‘give’, but is normal with other verbs such as ‘owe’, ‘borrow from’, ‘teach’.",ex301;ex448,xu-peyraube-1997[106],A V R T
constr167,yuec1235,Dative Construction,"This construction uses the preposition bei, which is often regarded as a serial verb.",ex302,xu-peyraube-1997[106],A V T bei+R
constr168,kung1261,Indirective Construction,"In this construction, T follows the verb and R is introduced by the oblique (“transitive”) preposition kē. Canonical ditransitives (including à’ā GIVE1) allow for both the secundative and the indirective construction. Some other verbs (e.g. nē’ē GIVE2) only allow for the indirective construction, and need ‘a’-promotion (quasiapplicative) to form a secundative pattern",ex303;ex449,konig-heine-2010,A (TOP) V T kē R
constr169,kung1261,Secundative Construction,"In this construction, R follows the verb and T is introduced by the oblique (“transitive”) preposition kē. Canonical ditransitives allow for both the secundative and the indirective construction. Some other verbs (e.g. heal/treat) only allow for the secundative construction. Compare also example (18b) (with nē’ē - ‘give3’) with the derived quasiapplicative -a.",ex304;ex450,konig-heine-2010,A (TOP) V R kē T
constr170,kung1261,Possessive Monotransitive Construction,"In this construction, R follows the verb and both R and T are unmarked. It looks like a double object construction, but it is actually a possessive construction (ex. 1650 lit. ’refuses woman’s medicine’). Noted for REFUSE and STEAL and other verbs of dispossession.",ex305,konig-heine-2010,A (TOP) V R T
constr171,kung1261,Benefactive Indirective Construction,In this construction T follows the verb and R is introduced with preposition à’ā (historically the verb GIVE).,ex306,konig-heine-2010,A (TOP) V T à’ā R
constr172,fonn1241,Double Object Construction,Both R and T are unmarked (with full NP); the word order is variable.,ex307;ex451,ch03lefebvre1994,A V T R
constr173,fonn1241,Indirective Prepositional Construction,In this construction R is introduced by the preposition nú. This construction normally expresses R with less canonical ditransitives; with canonical ones it expresses beneficiary (see Lefebvre 1994: 8; (ib) and (iia)).,ex308;ex452,ch03lefebvre1994,A V T nú+R
