ID,Language_ID,Name,Description,Example_IDs,Source,Schema
constr174,fonn1241,Indirective Prepositional Construction,In this construction R is introduced by the preposition nú. This construction normally expresses R with less canonical ditransitives; with canonical ones it expresses beneficiary (see Lefebvre 1994: 8; (ib) and (iia)).,ex308;ex452,ch03lefebvre1994,A V T nú+R
constr175,fonn1241,Serial Verb Construction,"Here T is introduced by the verb sɔ́ ‘take’ and R by the verb ná ‘give’. Semantically it is different from the Double Object Construction in that the addressee is not (necessarily) a (successful) recipient (i.e. the construction does not necessarily imply a successful transfer, as seen in example (24) in Lefebvre 1994: ‘Koko gave the crab to Asiba, but the crab is not hers’).",ex309;ex453,ch03lefebvre1994,A sɔ́+T V R
constr176,newa1246,Indirective Dative Construction,"Flagging is indirective: A carries the ergative and R the dative. T is usually unmarked (unless human; see Double dative construction under Animacy Effects). Indexing is neutral, as the verb agrees with the subject.",ex310,,A-erg R-dat T(-abs) V.subj[A]
constr177,amha1245,Dative Construction,"A is unmarked and R is marked by the preposition lə (proclitic). T is marked by the accusative suffix -n if definite. The verb optionally agrees with R by means of object agreement suffixes. However, if R is 1st or 2nd person, pronoun agreement is obligatory.",ex311;ex454,ch001amberber2009,A-nom lә+R T(-acc) V.subj[A].(obj[R])
constr178,amha1245,Double Object Construction,Here R is in accusative case and T is unmarked (Amberber 2002: 48 mentions avoidance of double ACC marking). Interestingly object agreement is obligatory in this construction (in the Dative Construction it may be optional).,ex312,amberber-2002;ch001amberber2009,A-nom R-acc T V.subj[A].obj[R]
constr179,east2542,Secundative Ditransitive Construction,"Flagging is neutral: A, P, R, and T (sometimes also obliques) are unmarked. The (primary) object agreement (P/R) only occurs with R arguments. (T-agreement is possible only in the absence of R; see Indirective R-less construction.)",ex313;ex455,rhodes-1990;ch21rhodes2005,subj[A].V.obj[R] T R A
constr180,east2542,Secundative R-less Construction,"In this (“pseudo-transitive” in terms of Bloomfield) construction, arguments are also unflagged, but the verb takes a separate secondary object agreement series for T marking. R is unexpressed in this construction (omitted, incorporated or reflexivized).",ex314;ex456,rhodes-1990;ch21rhodes2005,subj[A].V.obj[T] T A
constr181,halk1245,Secundative Applicative Construction,"The verb contains the applicative (recipient applicative) marker. The primary object R is unmarked (like P and A), while T is introduced by the oblique preposition ?ə. R (like P) is indexed by object agreement suffixes. T is unmarked, the same holds for A except for 3rd person As, which are indexed by the ergative suffix.",ex315;ex457,ch001gerdts1982,V-APPL-TR-r/p-(a) R ?ə T
constr182,zulu1248,Double Object Basic Construction,"Basic ditransitives form a double object construction, where R is marked by the object agreement suffix. Note however that if T is topical, it can also be indexed (see (31a)).",ex316;ex458,poulos-1982,A subj[A].obj[R].V R T
constr183,zulu1248,Double Object Applicative Construction,"This is also a double object construction, but here object agreement with BEN seems more regular.",ex317;ex459,poulos-1982,A a/s-(r/p/t)-V-appl R T
constr184,nucl1284,Dative Construction,A/S are unmarked. R is in the dative and T is normally unmarked. The (suffixal) agreement is only with the subject (A/S). Thus DOM is suspended in ditransitives (except for pronominal Ts; see animacy effects).,ex318,neukom-patnaik-2003,A R-dat T V.subj[A]
constr185,soch1239,Monotransitive Prepositional Indirective,"This is a monotransitive construction where T is the main object and R is a prepositional object. Prepositional BEN marker ñícon ‘for’ is also used for both ‘to’ and ‘from’. T is unmarked. As in other cases only the subject is indexed on the verb. Note however, that the verb form changes depending on animate/inanimate T. The monotransitive construction unlike the ditransitive one indicates temporary rather than permanent transfer.",ex319;ex460,,V.subj[A] A T ñí’con+R
constr186,soch1239,Ditransitive Inanimate Construction (with inanimate T),"In this construction with inanimate T, both T and R are unmarked; neither is indexed (indexing of subject A argument). The form of the verb however is distinct for animate and inanimate themes (an indirective feature). Yet the choice of the direct here vs. inverse forms is sensitive to hierarchy relation (1/2 > 3 > 3/obv) between A and R arguments (a secundative feature). The ditransitive construction (unlike the monotransitive one) indicates permanent transfer.",ex320,,V.subj[A] A R T
constr187,soch1239,Ditransitive Animate Construction (with animate T),"In this construction both T and R are unmarked; neither is indexed (indexing of subject A argument). The form of the verb however is distinct for animate and inanimate themes (an indirective feature). The verb form is also sensitive to the hierarchy relation between A and T arguments (1/2 > 3 > 3/obv), conditioning the use of direct vs. inverse forms (another indirective feature). The ditransitive construction (unlike the monotransitive one) indicates permanent transfer.",ex321;ex461,,V.subj[A] A R T
constr188,ewee1241,Double Object Construction,"The arguments are unmarked (no case). There is no indexing either (but see indexing comments). The order is either AVTR, or less usually AVRT. In this construction T is indefinite.",ex322;ex462,essegbey-1999,A V T R
constr189,ewee1241,Serial Verb Construction,The T argument is introduced by the serial verb tsɔ́ TAKE. In this construction T is definite and R is indefinite. The serial verb construction is generally used to avoid the definite-T constraint (see animacy and person).,ex323;ex463,essegbey-1999,A V T V R
constr190,kaza1248,Dative Construction,"Dative recipient construction, with differential P/T marking dependent of definiteness/specificity.",ex324,mawkanuli-na,A-nom R-dat T-acc V.subj[A]
constr191,nucl1643,Dative Construction,"The dative accusative construction, with the R marked by the dative postposition ni, and T/P marked by the accusative postposition o. (A is marked by the topic marker wa or the (new) subject marker ga). There is no indexing on the verb (except for subject honorifics).",ex325;ex464,ch001miyagawatsujioka2004;matsuoka-2003,A ga/wa R ni T o V
constr192,swah1253,Double Object Construction,"A double object construction (with A, T, and R unmarked). The indexing is secundative: object prefixes index R.",ex326,ch001vitale1981,A subj[A].obj[R].V R T
constr193,supy1237,Dative Prepositional Construction,"A and T/P arguments are unmarked, R is introduced by the postposition á. R is postverbal as other oblique (prepositional) objects. No indexing on the verb. This is the basic ditransitive construction.",ex327;ex465,carlson-1994,A T V R+á
constr194,supy1237,Serial Verb Construction: Shifted Pattern,Serial verb construction involving kan GIVE also has a prepositional and shifted versions (like the main verbs kan). The verbs in an SVC are related by a connective marker.,ex328,carlson-1994,(A P V1) CONN R V
constr195,supy1237,Dative Shifted Construction,In this construction R is shifted into the preverbal object position; the T is marked by the preposition na ‘at’. Only kan GIVE (and ASK/beg) permit a dative shift. Dative shifted are rare (3%) of cases (p. 400),ex329;ex466,carlson-1994,A R V T+na
constr196,supy1237,Serial Verb Construction: Indirective Pattern,Serial verb construction involving kan GIVE also has a prepositional and shifted versions (like the main verbs kan). The verbs in an SVC are related by a connective marker.,ex330,,(A P V1) CONN T V R á
constr197,panj1256,Dative Construction (non-perfective tenses),"In the dative construction, R is followed by the postposition nüü and T is unmarked (even though Ps show DOM). Indexing is neutral insofar as the Verb shows gender agreement with the subject. Note that in non-perfective tenses the alignment is accusative (the subject lacks ergative marker and controls verbal agreement).",,bhatia-1993[173],A R+nüü T V.subj[A]
constr198,lazz1240,Dative Construction (non-perfect series),"In this construction, flagging is indirective: R takes the dative case, while T (like P) is unmarked (flagging of pronouns is neutral though, as 1,2 p. pronouns don’t distinguish between ergative, absolutive and dative cases). Indexing is secundative insofar as the object agreement prefixes, index R not T (except for cases when T is higher than R on the person/animacy hierarchy, or is equal to R see Animacy Effects).",ex331;ex467,,A.erg R.dat T (a/s-)r/p-V-(a/s)
constr199,cash1254,Double Object Construction,"In the double object constructions with nominal arguments, A is in ERG, and both R and T are in the (unmarked) ABS case. There is no indexing on the verb except for the plural subject marker (with 3rd person human/animate subjects).",ex332;ex468,camargo-2007,A-erg R-abs T-abs V.subj[A]
constr200,lazz1240,Benefactive Construction (non-perfect series),"This construction is used for beneficiaries with less canonical ditransitives. The beneficary is introduced by the postposition/enclitic -šen(i) , T is unmarked. Like flagging , indexing is indirective. Kutscher (2001) regards this construction as monotransitive rather than ditransitive. A more frequent way to encodwe a beneficiary is a ditransitive construction with the benefactive “version” prefix u-/i- (see derived ditransitives under the dative construction)",ex333;ex469,,A.erg R-šen(i) T (a/s-)r/p-V-(a/s)
constr201,lazz1240,Allative Construction (perfect series),This is an inverse construction with the experiencer subject in the dative case which controls object prefixees on the verb. Formally T behaves like a subject (riggers subject suffixes on the verb). In this construction R is coded by Allative case (”demoted to allative”; Lacroix) apparently to prevent doubling of dative case (on subject and object). This construction is found in the perfect series and in the potential derivation. The construction is indirective (if we compare it to the construction in the same series).,ex334;ex470,,A-dat R-all T subj[A].V.obj[T]
constr202,olut1240,Basic Ditransitive Construction,"The only basic ditransitive verb is mo:y? GIVE, all the other are derived (by the applicative). The alignment pattern of this verb is neutral in terms of coding: there is no flagging of core arguments, nor agreement with any of the object in the direct construction. yet the construction shows secundative properties, in particular the verb agrees with the R in the inverse.",ex335;ex471,zavala-maldonaldo-2002,A subj[A].V R T
constr203,olut1240,Basic Monotransitive Construction,"The only basic ditransitive verb is mo:y? GIVE, all the other verbs are derived (by the applicative). Usually, GIVE shows a ditransitive pattern with 3 core arguments, which is neutral in terms of coding, but shows also secundative properties (see basic ditransitive construction). However, an alternative pattern is monotransitive in terms of Zavala (2000: 668-9). This pattern is rather indirective insofar as T is coded as P (R is not expressed) and shows al the P-properties.",ex336,zavala-maldonaldo-2002,A subj[A].V T
constr204,olut1240,Applicative Ditransitive Construction,"Except for the GIVE verb, the construction with the Recipient-Beneficiary (also addressee, malefactive, external possessor) must be marked with the applicative suffix –ja:y?. Like the basic ditransitive construction this construction is neutral in coding in the direct construction (in the inverse indexing is secundative). Special phenomena: (1) Inversion In the inverse construction, P is cross-referenced by the absolutive proclitics on the verb (both A and P remain unflagged). Inverse is used when P outranks A in saliency (person/nimacy/topicality); p188-9. c) in the applicative construction, R undergoes inversion; p. 688 (33a) (2) Verbal number marking The suffix -küx signals plurality of the plural 3rd person A, but may also refer to plurality of P. fn the applicative construction, -küx can signal plurality of either T (695; (43b)) or R (43c).",ex337;ex472,zavala-maldonaldo-2002,A subj[A].V R T
constr205,panj1256,Dative Construction (perfective tenses),"In the dative construction, R is followed by the postposition nüü (Beneficiaries can alternatively be expressed by a complex postposition including a combination of the genitive postposition with laii ‘for’.) T is unmarked though (even though Ps show DOM). Indexing is also indirective insofar as the suffixal (gender) agreement indexes the objecvt (T/P). Note that in the perfective tenses the construction is ergative both in terms of flagging (ergative postposition) and indexing (gender agreement with the S/P/T arguments)..",ex338;ex473,bhatia-1993[173],A=ne R=nüü T V-t/p/s
constr206,yoru1245,Secundative Prepositional Construction,"This is the basic ditransitive construction (with a non-pronominal T), where R is unmarked and T is marked by the general locative preposition Ní.",ex339;ex474,atoyebi-2009,A V R ní+T
constr207,yoru1245,Secundative Serial Verb Construction,In this construction T is introduced by the auxiliary verb fi ‘take/use’ which is not used as a main verb. This construction must be used instead of the prepositional construction when T is pronominal. It can be used along with the secundative prepositional construction when T is definite.,ex340;ex475,atoyebi-2009,A fi T V R
constr208,yoru1245,Allative Indirective Construction,"With less canonical ditransitives with a directional meaning; T is unmarked, R is introduced by the preposition sí .",ex341;ex476,atoyebi-2009,A V T sí +R
constr209,yoru1245,Benefactive Construction,In this construction beneficiary is introduced by the preposition (or a serial verb) fún GIVE.,ex342;ex477,atoyebi-2009,A V T fún+R
constr210,lang1324,Secundative Double Object Construction,"In the double object construction, R is indexed on the verb , T is not.",ex343;ex478;ex537,noonan-1992,A subj[A].V.obj[R] R T
constr211,lang1324,Indirective Prepositional Construction,In the indirective construction R is introduced by the preposition bòt ‘to’; T is indexed on the verb. Indirective construction is chosen when T is given/definite/topical (p. 150).,ex344;ex479,noonan-1992,A subj[A].V.(obj[T]) T bòt+R
constr212,amel1241,Double Object “Shifted” Construction,"This construction is found only with the verb GIVE. It is exceptional in that the verb lacks the stem, only agreement (and tense) markers are present. It is also exceptional in that R is indexed in the first postverbal agreement slot normally reserved for P-agreement. (In other patterns the order of R and T indices is the opposite). As in other constructions flagging is neutral.",ex345;ex480,roberts-1987,A R T (V).obj[R].obj[T].subj[A]
constr213,amel1241,Double Object “Unshifted” Construction,"This construction is found with a few ditransitive verbs like SHOW and TEACH. As in other constructions objects are unmarked. T (when expressed) occurs in the first object agreement slot, R in the second slot. The order of object agreement suffixes is indirective, although no applicative marker is present. The same construction is also possible with benefactive verbs: beneficiary is encoded in the second slot. (Usually however, benefactives are expressed in the applicative construction).",ex346;ex481,roberts-1987,A R T V.obj[T].obj[R].subj[A]
constr214,amel1241,Indirective Applicative Construction,"This is the most productive constrruction wuith ditransitive verbs. As in other constructions flagging is neutral. Indexing is indirective insofar as T is cross-referenced in the first (object) agreement slot, and R is introduced by the applicative -i- marker followed by another object agreement marker. The same construction is normally used to introduce benefactives.",ex347;ex482,roberts-1987,A R T V-t/p-APPL-r-a/s
constr215,vafs1240,Double Object Construction (Non-Past Series),"In the non-past series, A/S is in the direct (nominative) case: both R and T are in the oblique case. T must be oblique if definite, otherwise it is unmarked (direct case). Thus there is a kind of differential marking of P/T arguments. In the non-past tenses, subjects are indexed by verb suffixes, T/P (if omitted and animate/definite?) can be indexed by oblique (set-II) clitics (procliticized to the verb).",ex348;ex483,stilo-2010,A(dir) T.dir/obl (t/p=) V-a/s R .obl
constr216,vafs1240,Adpositional R Construction (Non-Past Series),"This construction is indirective in flagging. R is introduced by an allative preposition o (with GIVE), a allative-locative preposition dæ with SAY/TELL and with benefactive postposition =ra with Beneficiaries. As in the double object construction, object show differential case marking depending on definiteness of T/P arguments. As in the other construction in the non-past series, A/S is unmarked and indexed by suffixes. In the non-past tenses, subjects are indexed by verb suffixes, T/P (if omitted and animate/definite?) can be indexed by oblique (set-II) clitics (procliticized to the verb)",ex349;ex484,stilo-2010,A(dir) o+R.obl T.dir/obl (t/p=) V-a/s
constr217,vafs1240,R-Indexing Construction (Non-Past Series),"In this construction, used when R is pronominal, R (like P) is indexed by an oblique pronominal clitic. However, R (unlike P which can be marked by a proclitic on the verb), is indexed by an oblique enclitic on the T argument. In this construction as in the other constructions in the non-past series, A/S is unmarked and indexed by suffixes. R-indexing construction is apparently restricted to non-past tenses. A further restriction concerns the fact that T must be indefinite (constructions with definite Ts must use a flagging construction with free pronouns marked as oblique).",ex350;ex485,,A(dir) T.dir/obl=r (t/p=)V-a/s
constr218,vafs1240,Double Object Construction (Past Series),"In the past series, A/S is in the oblique (ergative) case, T can be either direct or oblique (depending on definiteness?), while R is invariably in the oblique. T (like P) can be indexed by verbal suffixes (if unmarked?). A is indexed by oblique clitics (which either procliticize to the verb, or encliticize to a preceding element).",ex351;ex486,,A.obl T.dir/obl a=V-t/p R.obl
constr219,vafs1240,Adpositional R construction (past series),"As in the double object construction in the past series, A/S is in the oblique (ergative) case, T can be either direct or oblique depending on definiteness. T (like P) can be indexed by verbal suffixes (if unmarked?). R is introduced by an allative preposition (with 'give'), a locative preposition with 'tell' and with benefactive postposition with Beneficiaries. A is indexed by oblique clitics (which either procliticize to the verb, or encliticize to a preceding element).",ex352;ex487,,A.obl o+R.obl T.dir/obl a=V-t/p
constr220,abkh1244,Indirective Indexing Construction,"This construction is neutral in flagging as the core arguments are unflagged. It is indirective in indexing as T (like P but also S) is indexed by the absolutive prefixes, while R is indexed by the oblique/dative agreement prefixes (also used for obliques, as well as nominal possessors). A is indexed by still another set of prefixes in the pre-root slot. A variant of this construction (found with some other verbs) is the one where indirective agreement is introduced (followed) by applicative-like preverbs/relational particles; see the second example with 'tell' that uses the relational particle -a (see also benefactive construction under Derived ditransitives).",ex353;ex488,hewitt-1989,A R T obj[T].obj[R].subj[A].V
constr221,hixk1239,Indirective Postpositional Construction,"Both A and T/P are unmarked for case; R is introduced by the postposition =wya ‘to, by’. Indexing is also indirective: object suffixes index T (subject prefixes index A).",ex354,derbyshire-1979,T a+t-V A R=wya
constr222,hixk1239,Benefactive Internal Possessor Construction,The benefactive can also be expressed as a possessor of an object or an adjunct (then in combination with a verbalizing particle). Alternatively benefactive can be introduced by the postposition =hyaka ‘for’.,ex355;ex489,derbyshire-1979,?
constr223,lavu1241,Postpositional Indirective Construction,"The construction is indirective both in flagging and indexing: T characterizes it as a monotransitive with a postpositional adjunct. T (like P) is unmarked, R is introduced by the postposition na (cross-referencing the noun through the object prefix). The verb indexes T through the object agreement prefixes (and also A through the subject agreement slot).",ex356;ex490,terrill-2003,A R+na T obj[T].subj[A].V
constr224,malt1254,Accusative Construction,"SVO order, A unmarked, P coded with preposition lil if definite... [check!]",ex935,,A V [(lil) P]
constr225,huic1243,Monotransitive construction,,ex936,ch05comrie1982,
constr226,udih1248,Accusative Construction,"In the accusative construction the A is unmarked. P is usually accusative, but it may also be unmarked (nominative) if non-specific, or if the possessor of the P is coreferential to the subject (in that case the P takes reflexive-possessive suffixes instead of the accusative case).",ex937,ch10nikolaevatolskaya2001,A P-acc V.subj[A]
constr227,gama1251,Ergative Construction (with DOM),"In monotransitive construction, A is in ergative, P displays differential case marking: P is marked if definite (i.e. 1/2 + 3rd definite). Indexing is accusative, as the agreement for the S and A arguments is identical, and the P is indexed by separate agreement series (Watters 2002: 78-79).",ex1100,watters-2002[78f.],(A.erg) - R.obj - T - V-p-a/s
constr228,mala1464,Monotransitive construction,,,,
constr229,gaga1251,Ergative Indexing Construction,The construction is neutral in terms of flagging as both A and P are unmarked. Indexing is ergative insofar as as P/S arguments are indexed by the absolutive agreement prefixes in the first position and A by the ergative prefix in the second position.,ex1101,harvey-2002,A P obj[P].subj[A].V
constr230,even1260,Accusative construction,"In the accusative construction the A is unmarked. P is usually accusative, however, it may be unmarked (nominative) if the possessor of the P is coreferential to the subject (in that case the P takes reflexive-possessive suffixes instead of the accusative case).",,,A P-acc V.subj[A]
constr231,kwaza,Monotransitive construction,,ex938,,
constr232,finn1318,Accusative Construction,"A is unmarked, T in accusative (or partitive) case depending on definiteness/specificity. Subjects (A/S) are indexed through subject agreement.",,,A V.subj[A] P-acc
constr233,tari1256,Monotransitive construction,,ex939,,
constr234,mode1248,Monotransitive construction,,,,
constr235,lele1276,Monotransitive construction,,ex940,,
constr236,thai1261,Monotransitive construction,,,,
constr237,cavi1250,Monotransitive construction,,ex941,,
constr238,kiny1244,Monotransitive construction,,ex942,,
constr239,hung1274,Monotransitive construction,,ex943,ch001keneseivagofenyvesi1998,
constr240,sahaptin,Monotransitive Construction,"Argument coding in this construction is quite complicated. The schema ""a.V A P-na"" is valid only for 3rd-person nominal A and P. When P is a deictic person, A takes the ergative suffix -nim, and P is expressed by enclitic indexes which can also express A or S. When A is nominal and P is 3rd person anaphoric, P is expressed as a prefix on the verb.",ex944;ex2083;ex2084,rude-1997;rude-2009,a.V A P-na
constr241,nucl1302,Present Series Construction,,ex945,,
constr242,mana1295,Monotransitive construction,,ex946,,
constr243,kaya1319,Monotransitive construction,,ex947,,
constr244,even1259,Accusative construction,"In the accusative construction the A is unmarked. P is usually accusative, however, it may be unmarked (nominative) if the possessor of the P is coreferential to the subject (in that case the P takes reflexive-possessive suffixes instead of the accusative case).",ex948,,A P-acc V.subj[A]
constr245,tami1289,Accusative construction,"A/S are unmarked, P is marked if animate/definite (DOM), A is indexed by agreement suffixes.",ex949,,A P-acc V.subj[A]
constr246,wari1268,Monotransitive construction,,ex950,,
constr247,leti1246,Monotransitive construction,,,,
constr248,abkh1244,Ergative indexing construction,"Flagging is neutral as there is no case on core arguments. Indexing is ergative insofar as S/P are indexed in one agreement slot, while A in another slot: there is also some formal differences between these sets of agreement markers (in the 3rd person).",ex951,,A P obj[P].subj[A].V
constr249,alam1246,Neutral-accusative construction,A and P are unflagged; they are indexed by the subject and object enclitics respectively.,ex952,,A P V.subj[A].obj[P]
constr250,amel1241,Accusative Indexing Construction,"In this construction subject and objects are unmarked; indexing is accusative insofar as the subject is indexed by the verb final suffixes, while the object is indexed by suffixes immediately after the verb.",ex953,,A P V.obj[P].subj[A]
constr251,amha1245,Accusative Construction,"Flagginng is (optionally) accusative: definite Ps take the accusative case. Indexing is accusative: A/S marked by subject suffixes, P is optionally by object suffixes if P is definite.",ex954,,A-nom P(-acc) V.subj[A].(obj[P])
constr252,yuec1235,Monotransitive Construction,,,,A V P
